,url,categoria,titulo,texto
70,https://www.infobae.com/tecno/2023/10/27/como-el-avance-de-la-inteligencia-artificial-podria-acelerar-el-desarrollo-de-videojuegos/,tecno,Cómo el avance de la inteligencia artificial podría acelerar el desarrollo de videojuegos,"La inteligencia artificial generativa, que produce texto, imágenes y audio en respuesta a solicitudes, tiene el potencial de transformar uno de los elementos distintivos de los videojuegos: los personajes no jugables, comúnmente llamados NPC o PNJ. Tradicionalmente, estos personajes se caracterizan por seguir patrones de comportamiento predefinidos y presentar gestos y diálogos a menudo forzados y poco realistas.“Cuando se piensa en esos NPC, parecen un poco extraños”, le dijo Alexis Rolland, director de Desarrollo de La Forge China, la rama china de la Unidad de Investigación y Desarrollo del editor de videojuegos Ubisoft a CNN. “Uno se da cuenta de que hay algo raro en lo que ve u oye”.Un ejemplo clásico de un personaje NPC en un videojuego es el comerciante en un juego de rol. En un juego de rol en el que se explora un pueblo medieval. El comerciante, un personaje NPC, está parado en su tienda y ofrece la posibilidad de comprar y vender objetos, armas y pociones. Aunque el jugador puede interactuar con él y realizar transacciones, no puede controlar su comportamiento ni su historia en el juego.Su papel es proporcionar a los jugadores una forma de adquirir y vender objetos esenciales para su aventura, pero no son personajes jugables en el sentido en el que es imposible tomar el control total de ellos. Los personajes NPC como este son una parte fundamental de la mayoría de los juegos y añaden profundidad y contexto al mundo virtual del juego.A principios de este año, La Forge lanzó Ghostwriter, una herramienta de IA generadora de texto diseñada para ayudar a los escritores de videojuegos a crear una mayor variedad de diálogos originales para los NPC, y en 2022, probó una nueva tecnología que ayuda a crear gestos más realistas y naturales que coinciden con el tono y el estado de ánimo de su discurso.“Toma el habla como entrada y genera gestos corporales como salida, así que podemos imaginar a esos NPC expresándose con diálogos no guionizados, teniendo una animación corporal casi natural, sintetizada a partir del habla”, contó Rolland. De esta forma se podría un NPC con IA con un comportamiento más natural e impredecible.Jitao Zhou, estudiante de la Universidad Rikkyo de Tokio, está haciendo precisamente eso: “Este NPC, que utiliza deep learning, no tiene un patrón fijo, por lo que puede tener una mayor variedad de movimientos”, explicó.Por otro lado, ya se ha empezado a implementar inteligencia artificial en algunos juegos. La compañía china, NetEase, emplea ChatGPT para la creación de los discursos de los personajes no jugables en su recién lanzado juego para dispositivos móviles llamado Justice.Al mismo tiempo, Replica Studios ha presentado la innovación de “NPC inteligentes impulsados por inteligencia artificial” para el popular motor de juegos Unreal Engine, permitiendo a los desarrolladores de videojuegos utilizar IA para interpretar los diálogos de los NPC en lugar de recurrir a actores de voz humanos.No obstante, Julian Togelius, profesor asociado en la Universidad de Nueva York, quien se dedica a la investigación sobre IA y videojuegos, planteó un riesgo inherente al emplear NPC generados por IA: la posibilidad de que los diseñadores de juegos pierdan el control de la trama del juego.Togelius advirtió que estos personajes virtuales podrían pronunciar diálogos que perturben la experiencia del juego al romper su coherencia, ser inapropiados o afectar la inmersión de los jugadores.El profesor también destacó la dificultad de crear personajes no jugables generados por IA que sean efectivos en su papel de ayudar al jugador. Añadió que desarrollar NPC “buenos” es mucho más complicado que diseñar enemigos que representen un desafío."
71,https://www.infobae.com/tecno/2023/10/27/forza-motorsport-asi-fue-la-integracion-de-ia-el-sistema-de-conduccion-y-sus-opciones-de-accesibilidad/,tecno,"Forza Motorsport: así fue la integración de IA, el sistema de conducción y sus opciones de accesibilidad","Forza Motorsport es una experiencia fiel a las competiciones de automovilismo. Su esencia no pasa por la exploración, sino por transmitir lo que significa estar en una pista frente a otros autos y querer ser el primero en cruzar la meta. Todo eso implica tener sistemas de conducción fieles, daños, pistas reales y una larga lista de vehículos.Para conocer los detalles de todo lo que conlleva el desarrollo de un juego así, desde Infobae hablamos con Dan Greenawalt, director general, y Chris Esaki, director creativo, de Turn 10 Studios, el estudio de Xbox que creó esta experiencia disponible en PC y en Xbox Series X y S.Los desarrolladores destacaron el trabajo hecho con inteligencia artificial para hacer que las carreras fueran más competitivas y cómo los rivales se adaptarán al nivel de los jugadores. Además, comentaron cómo fue el trabajo para trasladar la experiencia de manejo de un vehículo real a la simulación del videojuego, algo que llevan haciendo desde entregas pasadas junto a marcas, equipos y pilotos.Infobae: ¿Qué diferencia Forza Motorsport de los demás juegos de carreras, por ejemplo Horizon que también hace parte de la saga?Dan Greenawalt (DG): “Durante años Forza se ha caracterizado por tener un punto de vista único sobre las carreras y los autos. Forza, como franquicia, intenta que te enamores de los coches. Pero Horizon lo hace a través de la exploración y Motorsport con la habilidad y la competición.Uno de los enfoques está en la física de los vehículos. En este aspecto es una simulación completa”.Infobae: ¿Cómo se dio la integración de la inteligencia artificial para la creación del juego y la competencia de los jugadores?Chris Esaki (CE): “En esta ocasión, nos hemos centrado en garantizar que el jugador tenga una IA muy competitiva contra la que enfrentarse y desarrollar su habilidad al volante. Así que hemos reconstruido completamente nuestra IA y creamos un nuevo modelo de aprendizaje automático, por lo que ahora tenemos la IA más rápida que jamás hemos desarrollado.La inteligencia artificial ahora puede aprender tan rápido como nuestros pilotos en el mundo real, sin ningún tipo de trampa. Así que si eres un jugador de alto nivel, puedes poner la IA al máximo nivel de dificultad y encontrarás un gran desafío. Pero si eres un jugador no tan rápido, hay una gama amplia de dificultades para que la IA se ajuste y encuentres el nivel exacto para que la competencia sea divertida”.Infobae: ¿Las consolas de nueva generación han hecho que este trabajo sea más sencillo?CE: “La potencia adicional de las nuevas consolas nos ha proporcionado mucho dinamismo en el juego, con una física mucho más evolucionada y reconstruida que nos permite que nuestros vehículos sean increíbles, más profundos y requieran mucha potencia de procesamiento.Y, por supuesto, todas las dinámicas de los circuitos, como los ciclos diurnos y nocturnos de 24 horas, el clima dinámico y los cambios en las pistas. Esto es algo que está disponible en todos los circuitos y que hemos intentado optimizar, pero la potencia adicional nos ayuda a ofrecer a los jugadores un montón de nuevas dinámicas de juego”.Infobae: ¿Cómo fue el trabajo para trasladar los sistemas de manejo reales a la simulación del juego?DG: “Con Motorsport decidimos que dejaríamos que la física hiciera todo el ajuste por nosotros. Así que no ajustamos los coches a mano. Hacemos proyectos de física, investigamos y eso hace que los autos se sientan como deberían en el mundo real.Esto ha avanzado a medida que el PC y las consolas de Xbox se han vuelto más potentes. Con eso podemos aplicar más de esa física, investigar más y hacer más con el motor.CE: “Además, a lo largo de los años, hemos colaborado con fabricantes de autos, fabricantes de neumáticos y conductores, lo que nos ha ayudado a investigar y obtener información detallada sobre el funcionamiento de todos los vehículos, el funcionamiento de las dinámicas de cansancio y preguntarles a los conductores ‘¿cómo se siente esto?’ o ‘¿cuál es la diferencia entre tu experiencia en el coche real y este coche en el juego?’”.Infobae: ¿Qué opciones de accesibilidad tiene Forza Motorsport para las personas con discapacidad?CE: “Desde el primer juego ha habido cosas como la línea de conducción, que es una innovación que se puede ver en los coches reales de hoy en día y que ha permitido a la gente entrar en el juego y entender cómo controlar la dinámica de un vehículo complejo de una forma muy simplista.También tenemos un conjunto de ayudas que permiten a los jugadores invidentes ser competitivos y hacer buenos tiempos en el modo campaña. Estas ayudas también pueden ser útiles para cualquier jugador que quiera mejorar sus habilidades.Otro ejemplo es el desarrollo del concepto de aprendizaje natural, para esto se integraron las prácticas en el modo Carrera que facilitan que los jugadores se adentren en el juego, porque pueden probar un coche y empezar a entender cómo se comporta en pista antes de entrar en la carrera real”."
72,https://www.infobae.com/tecno/2023/10/27/honor-90-y-honor-90-lite-llegan-a-peru-y-colombia-precios-y-caracteristicas/,tecno,HONOR 90 y HONOR 90 Lite llegan a Perú y Colombia: precios y características,"Recientemente, HONOR lanzó al mercado de Colombia y Perú, los celulares HONOR 90 y el HONOR 90 Lite, así como la tablet PAD X9.Los celulares se caracterizan por el rendimiento de sus cámaras, por contar con varias funciones inteligentes impulsadas por el sistema operativo MagicOS 7.1, basado en Android 13. Igualmente, ambos ofrecen un hardware y un software revolucionarios para brindar a los usuarios un smartphone confiable.Durante la presentación en Bogotá, Colombia, estuvieron presentes en el Keynote David Moheno, director de comunicaciones para Latinoamérica; Camila Gutiérrez, directora de marketing HONOR Colombia; Chen Jie Lin, gerente general para HONOR Colombia y Melina Ramírez, embajadora de la marca.La cámara de este smartphone cuenta con un sistema triple que incluye una cámara principal de 200MP, una ultra gran angular y macro de 12MP, y una de profundidad de 2MP. Esto combina la fusión de fotogramas, un algoritmo de reducción de ruido y agrupación de píxeles lo que resulta en fotos HDR, detalladas y brillantes en condiciones de poca luz.En la parte delantera, la cámara frontal de 50MP captura selfies llenas de detalles, que integra herramientas con inteligencia artificial (IA) para eliminar el ruido de los videos, y AI Vlog Assistant, para generar un video de 15 segundos listo para subirse a redes sociales.Está equipado con una pantalla curva cuádruple flotante de 6.7 pulgadas, el HONOR 90 admite una alta resolución de 2,664 x1,200 píxeles, y hasta 1,070 millones de colores, lo que da vida a un contenido visual con tonos asombrosos y una claridad vívida. Asimismo, soporta un brillo máximo de 1,600 nits, lo que permite mejorar la legibilidad de la pantalla incluso en condiciones de mucha luz.Cuenta con atenuación dinámica que simula la luz natural para aliviar la fatiga ocular, así como la tecnología Dynamic Dimming y Circadian Night Display de HONOR, que filtra la luz azul y mejora la calidad del sueño del usuario por la noche.El HONOR 90 está disponible en una amplia gama de colores de moda, como Verde Esmeralda, Plata Diamante y Zafiro Real. Ya está disponible en Colombia con precios de venta al público que comienzan en $2,659,900 COP para el HONOR 90 de 256GB y de $2,999,900 COP para la versión de 512GB.Para elevar la experiencia fotográfica, el HONOR 90 Lite cuenta con una cámara principal trasera de 100MP con una apertura de f/1.9, una gran angular y de profundidad de 5MP, y una macro de 2MP para capturar paisajes y primeros planos detallados. Además, para los que aman las selfies, la cámara frontal de 16MP ofrece autorretratos con características definidas y colores mejorados.Por otro lado, la pantalla sin bordes de 6.7 pulgadas cuenta con una relación pantalla-cuerpo del 93.6%. Además, tiene una frecuencia de actualización adaptativa de hasta 90Hz, proporcionando a los usuarios una experiencia visual fluida.Adicional, la pantalla cuenta con la certificación TÜV Rheinland Low Blue Light y es compatible con una serie de soluciones de protección ocular centradas en el ser humano; como Dynamic Dimming y Circadian Night Display. Todo esto en conjunto promueve que los usuarios tengan un sueño más saludable y eviten la fatiga ocular. Estos aspectos son de mucha utilidad para quienes pasan varias horas en su smartphone.Además, cuenta con una gran unidad de almacenamiento con capacidad de 8+256GB y está equipado con HONOR RAM Turbo (8GB+5GB), una tecnología de la marca que traslada una parte de la memoria flash a la RAM, lo que significa que 8GB de RAM pueden alcanzar hasta 13GB de memoria.A partir del 26 de octubre, el HONOR 90 Lite de 256 GB está disponible por un precio de $1,990,900 COP en Colombia y por 1199.00 soles peruanos.La HONOR Pad X9, fabricada con un chasis de aluminio, brinda una experiencia táctil de alta calidad, lo que da la impresión de que se trata de una tablet de gama alta a pesar de su asequible precio, tanto en términos de grosor, tamaño y material utilizado.La pantalla de 11,5 pulgadas de la HONOR Pad X9, que ocupa el 86% del frente, presenta un panel de 2000x1200 con una frecuencia de actualización de 120 Hz. A pesar de tener una densidad de píxeles de 203 por pulgada, ofrece una calidad de imagen limpia, vibrante y nítida para disfrutar de contenidos.El dispositivo está equipado con el procesador Snapdragon 685, que se sitúa en la gama media de procesadores. Aunque no es el procesador más potente disponible en el mercado, se destaca por su eficiencia energética y de memoria, lo que proporciona un rendimiento destacado en la mayoría de los aspectos posibles."
73,https://www.infobae.com/tecno/2023/10/27/como-saber-en-que-sitios-web-instagram-comparte-mis-datos/,tecno,Cómo saber en qué sitios web Instagram comparte mis datos,"Recientemente, Meta trasladó una serie de controles adicionales al Centro de Cuentas para facilitar la administración de la información en otras aplicaciones fuera de la plataforma.De esta forma, los usuarios tienen aceso, por ejemplo, a los datos que Meta recopila sobre ellos cuando compran algo en sitios y organizaciones que utilizan los productos y servicios de la empresa como Meta Pixel, fragmento de código que ayuda a comprender mejor la efectividad de la publicidad.Con esta adición reciente, los usuarios tienen la capacidad de identificar a las organizaciones que comparten su información, eliminar los datos previamente proporcionados a Instagram y prevenir futuras divulgaciones de esta información.1. Abrir la aplicación de Instagram, ya sea desde un escritorio o un dispositivo movil.2. Dirigirse a las tres líneas que se encuentras en la parte superior de derecha de la pestaña del Perfil si se ingresa desde celular. Si la persona está realizando el proceso desde el escritorio, las tres líneas se ubican en la parte inferior izquiera del Inicio.3. Oprimir “Configuración y privacidad”.4. Seleccionar “Centro de Cuentas”.5. Acceder a “Tu información y permisos”, después oprimir “Tu actividad fuera de las tecnologías de Meta”.6. Ingresar contraseñas de Instagram.Finalmente, Meta visualizará los sitios que enviaron información sobre el usuario.No obstante, la complejidad radica en que, al hacer clic en la cantidad de interacciones que la empresa ha compartido con Meta, los usuarios no encontrarán un desglose detallado de las interacciones compartidas con Instagram. En su lugar, accederán a información adicional y un botón que les permitirá descargar los detalles de la actividad.Al solicitar la descarga, se obtiene un archivo que abarca toda la información de la cuenta de Instagram, sin embargo, no se revela específicamente qué es lo que otros sitios comparten acerca del usuario.Dentro del menú de “Actividad reciente” ubicada arriba de la lista de sitios, se presenta la opción de “Borrar actividad anterior” o “Desconectar actividad específica”. La primera alternativa eliminará toda la información que Instagram posee sobre el usuario en relación a terceros, pero no evitará futuros intercambios de información con los mismos sitios.Para llevar a cabo un proceso exhaustivo, se recomienda comenzar seleccionando “Desconectar actividad específica” y optando por un sitio específico que se desee desconectar. Aunque parece contradictorio empezar por esta segunda opción, borrar la actividad previa evitará que se realice la desconexión con terceros, ya que los nombres y la opción de desconexión desaparecerán. Esto implica que se deberá esperar hasta que vuelvan a aparecer en el menú para bloquearlos definitivamente.En el menú de “Actividad reciente”, también está disponible la opción de tocar el nombre de una empresa y elegir “Desconectar”. Sin embargo, es importante tener en cuenta que esta alternativa implica desconectar los sitios de manera individual, lo cual no resulta tan eficiente en comparación con la opción de “Desconectar actividad específica”, que permite una desconexión más generalizada.Meta centrará el próximo año sus esfuerzos en el desarrollo de la inteligencia artificial (IA), que pasará a ser su principal área de inversión, así como en conseguir que Threads se convierta en “una aplicación de conversaciones públicas de mil millones de personas”, pese a que actualmente registra 100 millones de usuarios.Más de 3.900 millones de personas usan al menos una de la aplicaciones de Meta cada mes, una cifra que el director ejecutivo, Mark Zuckerberg, ha compartido con motivo de los resultados financieros correspondientes al tercer trimestre de 2023. Los servicios de vídeo representan más de la mitad del tiempo que se pasa en Facebook e Instagram.La última adición a las aplicaciones sociales, Threads, que la compañía lanzó en julio, cuenta actualmente con menos de 100 millones de usuarios activos mensuales. Zuckerberg ha señalado que van a centrarse en el crecimiento de la comunidad, ya que han detectado que “a la gente le encanta hasta ahora”.“He pensado durante mucho tiempo que debería haber una aplicación de conversaciones públicas de mil millones de personas que sea un poco más positiva, y creo que si seguimos así durante unos años más, creo que tenemos una buena oportunidad de lograr nuestra visión”, ha afirmado."
74,https://www.infobae.com/tecno/2023/10/27/usuarios-de-steam-en-latinoamerica-se-veran-afectados-por-nuevos-cobros-en-dolares/,tecno,Usuarios de Steam en Latinoamérica se verán afectados por nuevos cobros en dólares,"La situación económica mundial ha afectado a la industria de los videojuegos en diferentes aspectos y recientemente Steam decidió modificar los precios de su tienda en ciertos países, donde los usuarios ya no podrán pagar con su moneda local, sino que tendrán que hacerlo en dólares.Esta decisión afectará a naciones en Latinoamérica, Oriente Medio y África del Norte a partir del 20 de noviembre, ya que si se mantienen los valores de las monedas locales, los desarrolladores y la tienda de juegos para PC verán afectados sus ingresos, además los usuarios podrían ver una elevación en los precios.Argentina y Turquía son dos de las naciones que impulsaron esta decisión por su situación económica, que genera que los precios en sus tiendas sean de los más bajos en el mundo. Aunque el cambio de los valores a dólares estadounidenses se verá reflejado en otros 23 lugares:Centroamérica– Belice– El Salvador– Guatemala– Honduras– Nicaragua– PanamáSudamérica– Argentina– Bolivia– Ecuador– Guyana– Paraguay– Surinam– VenezuelaOriente Medio– Baréin– Egipto– Irak– Jordania– Líbano– Omán– Palestina– Turquía– YemenÁfrica del Norte– Argelia– Libia– Marruecos– Túnez– SudánLa decisión de Steam de cambiar a precios en dólares en estos países se basa en varios factores clave. La inestabilidad del tipo de cambio en Argentina y Turquía ha dificultado a los desarrolladores elegir precios adecuados y mantenerlos actualizados en sus monedas locales.Esta volatilidad ha generado diferentes dificultades, incluyendo la actualización constante de los métodos de pago y la lucha contra las fluctuaciones en el cambio de moneda extranjera, tarifas, impuestos y problemas logísticos.La tienda de Valve ha tenido en cuenta los comentarios de los desarrolladores y ha decidido implementar este cambio para proporcionar una mayor estabilidad y consistencia tanto para los jugadores como para sus asociados, “a la vez que nos permitirá seguir ofreciendo una variedad de métodos de pago a los usuarios en estos países o territorios”, publicó la plataforma en un comunicado.Para resolver las inquietudes de los usuarios afectados por esta decisión, Steam aclaró ciertas situaciones que pueden ser frecuentes, como saber qué va a pasar con las suscripciones y las transacciones dentro de los juegos.- Qué pasará con el saldo en la Cartera de Steam en las monedas locales:El 20 de noviembre de 2023, cualquier saldo en la Cartera de Steam se convertirá a USD a la tasa de cambio del día.- Habrá o no aumento de precios por el cambio de moneda:Los precios de los juegos se ajustarán según cómo los desarrolladores los fijaron antes de este cambio, lo que podría resultar en aumentos o reducciones de precios, por lo que no habrá una situación general.- Qué pasará con las transacciones dentro de los juegos:A partir de entonces, las transacciones dentro del juego se realizarán en USD de manera predeterminada en regiones y países mencionados.- Qué pasará con las suscripcionesLas suscripciones activas en Steam que están en monedas locales finalizarán automáticamente al concluir el período de la suscripción activa. Los usuarios pueden renovar sus suscripciones, pero ahora lo tendrán que hacer pagando en dólares.Aunque la empresa japonesa no quitó la regionalización de precios, sí puso una restricción grande en la tienda argentina. Debido a la situación económica del país, la eShop de allí tenía precios muy bajos, lo que generó que usuarios en otras regiones empezaran a comprar en esa plataforma aprovechando la devaluación del peso.Así que Nintendo decidió limitar las compras que no fueran con tarjetas o medios de pago locales, lo que hace casi imposible que una persona que no esté en Argentina pueda adquirir un juego en esa tienda, ya que los valores de los títulos eran dos o tres veces menores en comparación con otros mercados."
