,url,categoria,titulo,texto
42,https://www.infobae.com/deportes/2023/10/29/rifas-sacrificios-presos-por-error-y-el-autodromo-como-terapia-las-increibles-historias-de-la-gente-en-el-turismo-carretera/,deportes,"Rifas, sacrificios, presos por error y el autódromo como terapia: las increíbles historias de la gente en el Turismo Carretera","El capital más importante que tiene el Turismo Carretera es su gente. Esos miles de fieles que desde hace 86 años acompañan a la categoría más importante de la Argentina y que pese a las crisis y vaivenes económicos como antes pasaba a la vera de la ruta ahora llenan los autódromos de todo el país. Detrás de esa multitudinaria peregrinación tuerca hay muchas historias y para conocerlas Infobae caminó detrás del alambrado. Se trató de un recorrido para profundizar cómo se vive esta pasión popular que trasciende lo deportivo y hay quienes lo toman como terapia necesaria para su vida.Se trata de un cordón humano que se ubica al perímetro del circuito. La escenografía muestra banderas, carpas, casas rodantes, autos, colectivos, tractores y camiones con acoplado cuyos techos se convierten en “palcos VIP”. Corresponde a una aldea nómade que recorre el país y que orilla los 30 mil a 50 mil espectadores, dependiendo la capacidad del escenario. Junto a cada grupo se encuentra una parrilla que desafía el aumento de precio del asado y es una especie de “tótem”, un elemento sagrado que acompaña las carreras desde el propio nacimiento del TC, aquel 5 de agosto de 1937.Sus grupos se nutren de familias y amigos. Muchos de ellos se conocieron en los autódromos y el automovilismo pasó a ser una excusa para el reencuentro. Entre ellos hay un código social inquebrantable y que consiste en el respeto con el otro más allá de la marca de sus amores. En un mismo predio pueden convivir cuatro hinchadas: Ford, Chevrolet, Dodge y Torino. De hecho, se cruzan durante todo el fin de semana y gane uno o pierda el otro, el tema no pasa de las cargadas. Hasta pueden verse hinchas de Colón y Unión de Santa Fe juntos. Se prestan las parrillas, convidan alimentos, bebidas y comparten todo. Es una especie de cooperativa gigante detrás de una pasión.Viajan como pueden y se organizan según su economía para poder asistir a una carrera. Entre rifas, ahorros y sacrificio, el público es leal a esta especie de religión y vive un ritual cada fin de semana. El recorrido se dio en el Autódromo de San Nicolás en una provincia de Buenos Aires que supo ser un bastión teceísta por la cantidad de escenarios ruteros y que luego fueron reemplazados por circuitos como este, La Plata, Olavarría, Mar de Ajó y Junín.Se inició la caminata y su color invita recolectar más testimonios. “Venimos de Buenos Aires y de Marcos Paz. El TC es una pasión que se comparte con amigos. Es pasarla bien”, afirma Daniel que es hincha de Ford. En un autódromo encontró a otro “camarada” del Óvalo y se hicieron amigos: “Nos conocimos hace dos años acá en el autódromo. Yo vengo con mi hermano y mi sobrino”, cuenta Javier delante de una bandera Chevrolet, algo común en los circuitos y sin ningún tipo de agresión por la marca rival, no enemiga. “Después hay chicos de diferentes lugares, de Casilda (Santa Fe) y nos juntamos acá. Esto es algo que lo llevás adentro. Venimos acá, hacemos un asado, nos tomamos un traguito. Acá está el asadito y en las conservadoras, agua mineral sin gas (risas). Más que nada la cargada entre los hinchas de Ford y Chevrolet”, agrega Javier. “Ford y Chevrolet no es como un clásico River-Boca. Es todo familiero. Fijate, Chevrolet, Ford, todos compartiendo acá un fin de semana. Nos cargamos, no nos peleamos. Esto no pasa en el fútbol”, explica. “Nosotros venimos predispuesto de la mejor forma y creo que todos los que estamos en un autódromo pensamos así. Somos cinco generaciones en este grupo”, apunta otro hincha.Si de tradición se trata estos hinchas no están de acuerdo con los nuevos autos que se vendrán a partir de 2024 con el reemplazo de los emblemáticos Ford Falcon, cupé Chevy de Chevrolet, Dodge GTX y Torino, por el Ford Mustang, Chevrolet Camaro, Dodge Challenger, un restyling de Torino que ya fue definido por la Asociación Corredores Turismo Carretera (ACTC) y el Toyota Camry seguirá con las modificaciones pertinentes. “Una pena si empiezan a desaparecer estos coches. Que dejen los autos que están ahora”, afirma Javier. “No nos gusta el Camaro. Queremos que estén el Falcon, la Chevy, el Dodge, el que está siempre. Pero bueno, algún día va a llegar el cambio, habrá que adaptarse, pero no será lo mismo”, agrega un integrante de ese grupo. “Que armen otra categoría para ellos. Tienen que ser las cuatro marcas y nada más. Para eso se distingue el TC. Pero acá estamos”, apunta otro fanático.La excursión continúa con otra decena de fieles por la música de los motores y el olor a combustible. “Es la primera vez que vengo y veo lo que es el ambiente y es otra cosa. Hay una gran diferencia con el fútbol, que son tres horas, hay conflictos permanentemente y lo vemos todos los domingos en casi todas las canchas. Acá todo el mundo está a disposición del espectáculo y es todo un fin de semana”, afirma Daniel. Adrián, hincha de Chevrolet, destaca: “Acá estamos con la gente de Ford, sin problemas”.“El TC es pasión, familia”, justifica Claudio. En tanto que Martín explica por qué es una terapia ir a un autódromo: “Es lo más lindo que hay. Te ayuda a olvidar de los problemas. Uno se desconecta de los conflictos que tiene en la semana como el laburo y uno viene acá pensando solamente en pasarla bien y ver autos de carrera”. Aníbal asevera: “Venís a pasar un lindo fin de semana. Te comés un asado. Conocés gente y hacés amigos”. Es moneda corriente ver a hinchas de distintas marcas como si nada y conversando. Se respira un aire sano. “Yo nunca vi en el TC que se peleen los hinchas. Acá hay asado, hay alcohol y nunca hay un problema. Si a alguien le falta algo, vos le das una mano y viceversa. Anoche llegamos y acá no teníamos lugar, pero los muchachos que son hinchas de otras marcas corrieron su auto y nos hicieron espacio”, culmina Walter.La caminata continúa y las banderas con el número 16 anuncia la presencia de la hinchada de Torino, la más sufrida de las cuatro y que estuvo 51 años para volver a celebrar un campeonato luego del obtenido en 2022 con José Manuel Urcera. Un “Torinero” (como se autodenominan) llamado Sergio Pascal relata que “Torino tiene el fuego sagrado. La pasión de la historia del ‘69, de aquella epopeya (N. de la R: en las 84 Horas de Nürburgring en las que el Torino fue el auto que más vueltas dio). Hoy tenemos a Torino en las pistas que nos mueve. Es como que te goza el alma ver un Torino en pista. Estando adelante en los primeros, estando peleándola en el puesto diez. En las buenas, en las malas”.Las hinchadas del TC son reconocidas por un número que surgió a raíz de la tribuna que ocuparon desde los años ochenta en el Autódromo de la Ciudad de Buenos Aires Oscar y Juan Gálvez. Ford es “La 4″, Dodge es “La 7″, Chevrolet es “La 15″ y Torino “La 16″, que es una de las tres gradas que se ubican en la zona opuesta del escenario porteño, en el sector del talud. “En un momento un puñado de Torineros se juntaron y fundaron La 16. Hice contacto con ellos. Pude juntarme con ellos y hoy la estamos representando. Es una pasión. Solo entiende mi locura quien comparte mi pasión”, explica.“Podemos convivir con las otras hinchadas por el respeto que nos tenemos. Yo puedo estar con uno de Ford y a veces tener mi propia visión de lo que es el TC. Porque ellos te van a tirar la chapa de los campeonatos que tienen. Y nosotros salimos campeón el año pasado. Pero se dialoga, se charla, nos prestamos las parrillas. Hay que vivirlo. No es como el fútbol”, subraya.Sobre cómo hacen para ir a las carreras en plena crisis económica, cuenta: “Vos tenés que planificar durante todo el año. Yo no voy a todas las carreras. Yo soy de Concepción del Uruguay. Vengo de 400 kilómetros y me hice una logística”.Sergio, al igual que todos los hinchas, forman grupos y tienen una organización propia para poder solventar los gastos. Suman todo lo que compran y lo dividen. Lo que más gastan es en comida, bebida y el combustible para el traslado. Según la distancia que deban cubrir el promedio es de seis carreras al año a las que pueden asistir. Algunos más y otros menos. Todo depende del bolsillo. Para reducir costos venden rifas, la comida que pueda guardarse la compran tiempo antes por la inflación y pese al delicado contexto los circuitos en los que corre el TC muchas veces tienen que cerrar las puertas el domingo por la mañana porque están colapsados de público.Costos de accesos:Entradas (pagan todos menos los menores de 10 años con DNI y jubilados con carnet): 8.000 pesos para el sector general y 15.000 para los boxes.Estacionamiento: 3.000 pesos por vehículo.Costos generales:Tras un relevamiento, tomando como base un grupo de diez de personas, estos son montos que se suelen gastar desde su ingreso los jueves por la noche a un autódromo hasta el domingo terminada la actividad:Comida/Bebida/combustible/otros víveres: 300.000. Son 30.000 por persona, sin contar la entrada.El recorrido llegó a un colectivo con una carpa que cubrió el improvisado comedor. En pleno almuerzo otro grupo se prestó a un diálogo picante con chicanas entre las marcas y una imperdible anécdota.-¿Qué tiene Chevrolet que no tiene Ford?: “Todo. Estética. Vista. Hermosura. Rapidez”, responde uno del Chivo.¿Qué tiene Ford que no tiene Chevrolet?: “Motor. Ya está, listo. Terminamos la charla”, dispara uno del Óvalo.“Perreado”, lo chicanea otro de Chevrolet, por una palabra de la jerga en la que cuando un auto tiene algo irregular quiere decir que está “perreado”. “Detrás del motor viene la jauría. Todos los perritos”, agrega en medio de risas del resto de los comensales.Aunque más allá de las diferencias aclaran: “Acá hay mucho respeto y camaradería. La idea es venir a pasarla bien. Relajarse y disfrutarla al máximo”. Los vínculos nacidos en un autódromo generan una confianza al punto que dos personas que se conocieron en una carrera de autos llegan a ser compadres.Sobre cómo hacen para estar presentes en medio comentan: “Hacemos rifas y después lo demás, todo a pulmón. Compramos dos o tres lechones y ahí hacemos las rifas. Así vamos juntando un poquito para amortizar un poco los gastos”.En tanto que guardan una anécdota que primero no fue divertida y hoy recuerdan con una sonrisa: “Una vez nos llevaron presos. Fue en La Pampa, que supuestamente rompimos el alambrado, cosa que nosotros no fuimos. Nos agarraron y nos llevaron presos. Estuvimos desde las dos o tres de la tarde hasta las cinco de la mañana”.“Y el campamento quedó todo armado. No había nadie en el autódromo. Ellos estaban en la comisaría. Cuando llegaron les faltaron cosas”, agrega otro hincha sobre esa anécdota.El tour llevó a un particular encuentro con santafesinos con hinchas de Colón y Unión abrazados y disfrutando de la jornada fierrera. Ante la consulta de cómo hacen para estar juntos en un autódromo pese a la rivalidad de camisetas, un Sabalero, a pleno abrazo con un Tatengue, respondió en broma: “Es lo mismo que acá, ellos son hijos nuestros, de los hinchas de Ford. Nos desquitamos acá”. El de Unión le responde “pero nosotros les llevamos cinco partidos”. Sobre cómo se traslada eso al automovilismo, otro asegura que “convivimos las hinchadas porque esto es una familia más allá de que seas hincha de Ford, Chevrolet”. Pero, ¿qué es el TC para ellos?: “Un sentimiento. Esto es compartir. Es una peña. No hay rivalidad. Se la pasa bien y viendo pasar autos de carrera, mejor”.Por último, el contacto fue con una familia nicoleña que son tuercas de alma y todo el año espera el evento. “Es una pasión que nos transmiten nuestros viejos. Más que nada por el nivel local del automovilismo. Mi padre laburó como mecánico en los zonales”, cuenta el hincha local. “Hay rivalidad, pero no hay violencia. Es un ambiente muy amigable. Se puede compartir con distintas marcas que nunca va a pasar nada”, agrega.Mientras que una simpatizante del Óvalo añade: “Nosotros siempre estamos esperando que llegue ese día para poder compartir todos en familia. Todos de Ford, de Werner (Mariano)”.El público se las arregla como puede y con planificación e ingenio los hinchas le ganan a la crisis para poder disfrutar de su pasión. Es un evento familiar en el que las carreras de autos sirven como excusa para el encuentro y para pasar un fin de semana entre amigos. En un país marcado por las grietas, las carreras de autos en la Argentina permiten una convivencia pese a las diferencias por una u otra marca, que supera al idilio que puede haber con los propios pilotos. Este es un humilde homenaje a la gente cuyo amor genuino por el automovilismo es de fierro.EL COLOR DE LA GENTE DEL TC"
43,https://www.infobae.com/deportes/2023/10/28/la-fiesta-de-cumpleanos-de-roscoe-el-perro-de-lewis-hamilton-que-hace-furor-en-las-redes-y-gana-mas-de-usd-700-por-dia/,deportes,"La fiesta de cumpleaños de Roscoe, el perro de Lewis Hamilton que hace furor en las redes y gana más de USD 700 por día","Uno de los deportistas más carismáticos es Lewis Hamilton, talentoso piloto que ha sido siete veces campeón del mundo en la Fórmula 1, que lleva una vida llena de extravagancias y tienen un fiel compañero a su lado: su perro Roscoe, un bulldog que lo acompaña por sus viajes a lo largo y a lo ancho del planeta, quien tiene su propio perfil en redes sociales y en las últimas horas sorprendió a todos con una publicación.A través de la cuenta de Instagram de Roscoe Hamilton, se supo que la mascota del piloto tuvo una celebración de cumpleaños en la que festejó junto a otros perros, con un pastel sobre la mesa, cotillón para los invitados, globos y más.El canino que pertenece a Hamilton cumplió 11 años, edad avanzada para un perro de su raza, y no dudó en inmortalizar el momento con una fotografía que explotó de interacciones en las redes. “Una vez es para el cumpleañero”, reza la descripción.Las felicitaciones de todos sus seguidores no se hicieron esperar, incluso algunos bromearon al respecto. “¿Por qué él tiene más amigos que yo?”, escribió una influencer llamada Ellie May. “¡Feliz Cumpleaños amiguito! ¡Parece que te lo has pasado muy bien!”, comentó Nicolas Hamilton, el hermano de Lewis.Roscoe ha alcanzado una gran fama, ya que cuenta con casi un millón de seguidores en su propia cuenta de Instagram. Su biografía en dicha red social revela su personalidad única: “Soy un bulldog vegano al que le encanta viajar, jugar a la pelota y recibir la atención de todas las chicas, especialmente cuando me frotan el trasero. Me gusta el frisbee y el tenis”.Es embajador de una agencia de mascotas gracias a su particular estilo de vida saludable y puede ganar más de USD 700 por una sesión publicitaria de fotografías “Roscoe es ahora parte de una agencia de modelos y tiene castings donde se enfrenta a 10 o 15 bulldogs. Me dijeron que necesitaban a un bulldog para anunciar un producto. Cobra 700 dólares por día, suena ridículo, pero recibe su premio y le encanta”, admitió el piloto en el 2018.También es muy reconocido por caminar por los paddock de la Fórmula 1, ya que sigue a todos lados a Lewis Hamilton, quien tenía otro bulldog llamado Coco, que era una hembra que murió en el 2020 cuando apenas tenía seis años. Es innegable que ambos siempre fueron como hijos para el piloto británico de 38 años, quien es una persona muy comprometida con el medioambiente y con los animales.Cada vez que Roscoe cumpleaños, Hamilton no duda en expresar su amor por él. “Hemos pasado por mucho juntos, hemos crecido juntos. No puedo explicar cuántas noches me ha tenido sin dormir con sus ronquidos. Pero igual es mi mejor amigo y una gran bendición en mi vida. Roscoe, papá te ama”, le escribió en su dedicatoria del año pasado."
44,https://www.infobae.com/deportes/2023/10/29/la-barra-de-fluminense-convoco-a-atacar-a-los-hinchas-de-boca-que-viajen-a-rio-de-janeiro/,deportes,La barra de Fluminense convocó a atacar a los hinchas de Boca que viajen a Río de Janeiro,"El sábado Fluminense y Boca Juniors definirán al campeón de la Copa Libertadores en un duelo que se celebrará en el Maracaná de Río de Janeiro, sede que fue elegida por Conmebol antes de que inicie la temporada. Casualmente, el cuadro carioca será uno de los protagonistas del duelo en el estadio que suele ser su casa y en la previa su barra ha anticipado que buscará generar caos.A través de posteos en redes sociales, los seguidores más violentos del Flu convocaron a agredir a todos los aficionados de Boca Juniors que viajen a Brasil. Cabe destacar que se espera una movilización cercana a los 100 mil xeneizes, pese a que poco más de 20 mil tienen entradas para el partido.“Para un racista, un golpe en la boca”, señala la pancarta que se ha vitalizado en las últimas horas y tiene como único fin convocar a los brasileños a agredir a los argentinos en Río de Janeiro. Sin dudas, un hecho que ha encendido las alarmas de la seguridad en la previa del gran duelo.Cabe recordar que a lo largo de la actual edición de la Copa Libertadores se han visto repetidos episodios de violencia, muchos de ellos ocurridos en Brasil. Es así que seguidores de Argentinos Juniors fueron golpeados salvajemente en las playas de Río de Janeiro en la previa del encuentro ante Fluminense por los octavos de final y de River Plate, también en ante el Flu en fase de grupos, en una pizzería horas después del partido.A su vez, hace tiempo que la Conmbeol trabaja para terminar con el racismo que muchas veces se observa en las tribunas del fútbol sudamericano y del cual los brasileños son víctimas. En abril de 2022, el organismo destacó que es “absolutamente inaceptable cualquier manifestación de racismo y otras formas de violencia en sus torneos” por lo que han endurecido los controles y las penas ante este tipo de episodios. Es así que cluibes como Boca Juniors, Racing, Newell’s, River Plate y Gimnasia han sido sancionados en ocasiones con multas de cientos de miles de dólares.Fluminense y Boca Juniors definirán el sábado al campeón de la Copa Libertadores. El cuadro brasileño viene de dejar en el camino a Inter de Porto Alegre, 4-3 en el global, y el Xeneize superó por penales a Palmeiras. El campeón, además de conseguir el máximo trofeo continental, se clasificará a los Mundiales de Clubes de 2023 y 2025."
45,https://www.infobae.com/deportes/2023/10/28/la-increible-historia-viral-de-un-nino-argentino-que-conocio-por-casualidad-a-una-estrella-de-la-nba-y-vivio-unos-dias-de-pelicula/,deportes,La increíble historia viral de un niño argentino que conoció por casualidad a una estrella de la NBA y vivió unos días de película,"Una historia que tiene como protagonistas a un niño argentino y una de las máximas estrellas de la NBA tiene conmovidos a todos los usuarios en las redes sociales. Se trata del sueño cumplido de Felipe Velázquez, de apenas 12 años, quien pasó días inolvidables junto a Jimmy Butler, la gran figura de los Miami Heat. Ambos generaron un lazo que parece inquebrantable pese a que los separan más de 7.000 kilómetros de distancia.Zoe Velázquez, hermana mayor de Felipe, relató a través de las redes sociales el paso a paso del encuentro con “el mejor tipo de este planeta”, como definió a Butler por los increíbles gestos que tuvo con ellos y su familia en un viaje que realizaron en enero de este año.“Esto empieza el 24 de enero cuando con mi familia íbamos a ver al Heat. Feli (mi hermano) es específicamente fan de Jimmy, literalmente lo adora desde que lo vio. Así que le hice un cartel para tirarnos un lance porque no teníamos idea si algún día íbamos a poder volver”, reza el hilo de Zoe en Twitter.La familia Velázquez llegó hasta el FTX Arena para ver un duelo entre Miami Heat y Boston Celtics con un cartel escrito en inglés que decía: “Jimmy, viajé más de 4405 millas para verte jugar, ¿podremos hacer una foto o tomar café?”. Pero su alegría se desvaneció rápidamente al enterarse que el escolta no iba a jugar ese partido, que estaba en su casa, ni siquiera había acudido al estadio.No obstante, el cartel de Felipe Velázquez llamó la atención de Jimmy Butler que miraba el partido por TV, así que no dudó en comunicarse con gente del Miami Heat para que tengan un trato especial: “TNT agarró el momento exacto donde yo le cuento a Feli la mala noticia. Jimmy no jugaba. El video se hizo re viral, y cuando me doy cuenta, gente del staff del Heat se estaba comunicando conmigo porque habían visto el video. Lo que procedió a llevarnos a la cancha en el entretiempo para darnos en vivo regalos que había mandado Jimmy desde su casa”, relató Zoe.Lo que parecía un gran gesto de Butler, fue solamente el comienzo. El ídolo del Heat quiso que Felipe no se perdiera la oportunidad de verlo jugar y, como contó Zoe, hizo todo lo necesario para que sucediera: “Jimmy nos pregunta si nos podíamos quedar a ver su próximo partido (era el 27 de enero), pero nosotros nos volvíamos el 26. A lo que el tipo se encarga de cambiarnos todo para que nos quedemos a verlo”.Las publicaciones de Zoe Velázquez muestran que Jimmy Butler y Felipe forjaron una gran amistad, la figura de la NBA compartió todo el tiempo que tuvo disponible con su pequeño admirador mientras esperaban por el duelo ante Orlando Magic en el que sí iba a jugar.“Nos llevaron al store del Heat para que agarremos lo que queramos. Nos invitó a cenar con él. No les puedo explicar el interés genuino que tenía el tipo en conocer a Feli. Realmente humilde. Y para mí era realmente irreal estar comiendo con un jugador de la NBA. Feli le contó a Jimmy (yo traduciendo) que hace skate desde chiquito, a lo que Jimmy procedió a decirle que al otro día lo llevaba a comprar uno. Pensamos que estaba jodiendo. No, al otro día lo llevo personalmente a comprarlo”, reveló la hermana del niño argentino.Finalmente, Felipe Velázquez pudo cumplir su deseo de ver jugar a Jimmy Butler, aunque a esa altura ya había vivido varias experiencias inolvidables con su jugador favorito. Incluso, no solamente asistió al partido en primera fila sino que tuvo acceso al vestuario y dio una arenga a los jugadores.“Jimmy vino a saludarnos pre partido y decirnos que iba a jugar lo mejor posible... ¿Saben que es lo cómico? Jimmy le dedicaba tantos a mi hermano, lo señalaba, le hacía gestos. En el entretiempo nos vino a decir que éramos de suerte porque cuando estábamos en la cancha parecía que ganaban. No termina acá, nos llevó al vestuario y estaban todos, hablé con Haslem, Vincent, etc, todos un amor y súper contentos de lo que estaba haciendo Jimmy.  Lo mejor fue que presenciamos la charla del coach post partido y lo dejaron hacer a Feli el saludo”, cerró Zoe.En el video, se lo puede ver a Felipe Velázquez muy nervioso al estar rodeado de las grandes figuras de uno de los equipos más icónicos que tiene la NBA. Todos gritaron “Argentina” por pedido suyo y le pusieron en broche de oro a unos días de película. Jimmy Butler, quien visitó el país al mes siguiente, seguramente seguirá en contacto con un pequeño admirador que se ha transformado en un amigo."
