,url,categoria,titulo,texto
16,https://www.infobae.com/deportes/2023/10/29/aceleracion-gambeta-y-remate-la-jugada-de-thiago-messi-que-se-convirtio-en-viral-e-hizo-recordar-a-su-papa-en-la-academia-del-inter-miami/,deportes,"Aceleración, gambeta y remate: la jugada de Thiago Messi que se convirtió en viral e hizo recordar a su papá en la Academia del Inter Miami","Lionel Messi generó una verdadera revolución en el Inter Miami, club con el que ya ganó un título (la Leagues Cup), llegó a una final (la US Open Cup) y no para de romper récords en cuanto a venta de tickets o merchandising. El impacto que provocó en los Estados Unidos también se traslada a su familia. Es que sus hijos mayores, Thiago y Mateo, se sumaron a la Academia de Las Garzas. Y sorprenden con su habilidad, cargada como un código QR en sus redes.Un video de Thiago, de 11 años, se hizo viral en las últimas horas. Con la casaca con el dorsal N° 10, presionó a un adversario en mitad de cancha, aceleró con la pelota para desprenderse de su víctima y, cuando otro rival quiso cruzarlo, dibujó un regate que lo dejó con la pierna levantada. Apenas pisó el área, remató al primer palo, pero su intento se marchó desviado y dio en un costado de la red.La difusión de las imágenes provocó un sinfín de reacciones en las redes. Desde emojis de joya o de fuego hasta un mensaje divertido que evoca los orígenes del campeón del mundo con la selección argentina: “Manden al chico a La Masía y terminemos con esta comedia”.Su papá acompaña sus primeros pasos y los de Mateo sin inyectarles presión. De hecho, los apoya como un espectador más, junto a su esposa Antonela Roccuzzo, y no emite palabra durante los cotejos, cuando se trata de una leyenda del fútbol. “Sólo quiero que hagan lo que les guste y sean felices”, repitió en más de una entrevista.De hecho, este sábado la Pulga estuvo en el Parque Regional North Collier observando a Thiago en un encuentro ante el Naples Elite Soccer Club. Como no podía ser de otra forma, Messi revolucionó por completo el club infantil y fue perseguido por decenas de fanáticos que le pidieron selfies, autógrafos o simplemente quisieron acercarse para saludarlo. Su guardaespaldas Yassine Cheuko veló por su seguridad a cada paso e incluso se sentó en las inmediaciones de una zona de descanso.La temporada para Messi no finalizó a pesar de que la franquicia no se clasificó para los Playoffs. Inter confirmó dos partidos amistosos en China. El primero, el 5 de noviembre contra Qingdao Hainiu FC en el estadio Wuyuan River en Haikou. Luego, el 8 de noviembre, se medirá frente al Chengdu Rongcheng en el Phoenix Hill Sports Park, con capacidad para más de 60.000 espectadores.Además, en noviembre afrontará la última doble Fecha FIFA con la selección argentina. El equipo dirigido por Lionel Scaloni enfrentará nada menos que a Uruguay (jueves 16 de noviembre en la Bombonera) y Brasil (martes 21/11 en el estadio Maracaná de Río de Janeiro). Pero antes, este lunes, el rosarino tendrá la chance de alzar su octavo Balón de Oro en la gala de la revista France Football a desarrollarse en el Teatro del Chatelet, en París. Es uno de los máximos candidatos a quedarse con el trofeo, junto con Kylian Mbappé o Erling Haaland.Por lo pronto, Thiago ofrece sus destellos, como para anticipar que el apellido Messi puede llegar a sostenerse en la élite por muchos años más."
17,https://www.infobae.com/deportes/2023/10/29/el-impresionante-remate-de-salomon-rondon-que-le-dio-la-victoria-a-river-plate-frente-a-gimnasia/,deportes,El impresionante remate de Salomón Rondón que le dio la victoria a River Plate frente a Gimnasia,"La visita de River Plate a La Plata para enfrentar a Gimnasia arrancó cuesta arriba por el tempranERo gol de Cristian Tarragona a los cuatro minutos. El equipo dirigido por Martín Demichelis sintió el golpe, le costó engranar juego y el entrenador se vio obligado a realizar varias modificaciones en busca de dar vuelta el marcador. Micho dio en la tecla con los ingresos de Facundo Colidio y Salomón Rondón, que fueron una inyección enérgica para el cuadro de Núñez, que marcó dos tantos en pocas jugadas.El venezolano cabeceó el córner que derivó en el disparo de Colidio y el fortuito rebote en la retaguardia de Paulo Díaz y le cambió el palo a Tomás Durso para estampar la igualdad. Cuatro minutos más tarde, Santiago Simón recibió en la banda derecha y filtró para Esequiel Barco, que se encontró en una buena posición cerca del área. El volante giró y cedió para el delantero de la Vinotinto que, de primera, cargó la potencia de su pierna derecha para colgar la pelota del ángulo.Salomón le dio al equipo exactamente lo que necesitaba en un difícil momento: un objetivo para lanzar pelotas largas, circulación de balón y efectividad en las jugadas de gol con poco tiempo de partido. Luego de la buena racha que logró Miguel Borja con cuatro goles en dos partidos, Rondón nuevamente se posiciona como el favorito de los hinchas del Millonario con dos participaciones claves para llevarse las tres unidades de una cancha complicada como la de Gimnasia.En los minutos restantes de juego, River aguantó el resultado detrás de la figura de Franco Armani, que tuvo varias intervenciones importantes a lo largo del encuentro. Con este resultado, el Millonario confirmó su liderazgo de la Zona A de la Copa de la Liga Profesional con 23 unidades y es casi un hecho que estará presente en los cuartos de final cuando termine la primera parte del segundo campeonato doméstico del año.En el calendario del cuadro de Núñez aparece el duelo frente a Huracán en el estadio Monumental el próximo viernes 3 de noviembre, el último cotejo del año en Núñez. Luego visitará a Rosario Central por la jornada 13 el domingo 11 del mismo mes y cerrará ante Instituto posiblemente en el estadio Madre de Ciudades de Santiago del Estero producto de los recitales que se realizarán en el Antonio Vespucio Liberti durante esa etapa del mes."
18,https://www.infobae.com/deportes/2023/10/29/liga-profesional-colon-y-atletico-tucuman-abriran-la-accion-del-domingo-en-un-duelo-clave-por-la-permanencia/,deportes,Independiente iguala 0-0 con el descendido Arsenal en el cierre de la jornada de domingo de la Copa de la Liga,"Independiente - ArsenalIndependiente recibe al descendido Arsenal de Sarandí en la continuidad de la undécima fecha de la zona A de la Copa de la Liga Profesional de Fútbol (LPF). El encuentro se juega en el estadio Libertadores de América, con arbitraje en campo de Fernando Rapallini.El Rojo viene de perder con contundencia ante River Plate (3-0) en el Monumental y tratará de recuperarse con el apoyo de su gente.En el local estará desafectado el mediocampista Santiago Toloza, quien reapareció con River pero salió con una molestia física y será nuevamente preservado. La incógnita pasa en torno a si continuará Lucas González en la mitad de la cancha o si se inclinará por apostar por Felipe Aguilar para defender con tres zagueros y, de esta forma, permitirles a los laterales desprenderse con mayor tranquilidad.Por su parte, Arsenal está descendido aunque en la jornada pasada dio la sorpresa frente a Colón de Santa Fe, al que le ganó por 1 a 0 en Sarandí. La vuelta de Cristian Chimino parece una realidad al lateral derecho para darle más experiencia a la zona del fondo.Formaciones:Árbitro: Fernando Rapallini.VAR: Nazareno Arasa.Estadio: Independiente.TV: ESPN Premium.Colón 1-0 Atlético TucumánColón de Santa Fe venció 1-0 a Atlético Tucumán y logró salir de la zona de descenso a cuatro fechas de la definición. Este triunfo alienta sus esperanzas de salvación en el debut de su nuevo director técnico, Israel Damonte. El único gol del encuentro jugado en el Estadio Brigadier Estanislao López fue Nicolás Romero en contra tras un remate de Eric Meza. Además, el Sabalero es tercero en la Zona A del torneo.En el comienzo Colón fue más y jugó en el campo rival, tuvo un planteo mesurado. Los jugadores del Decano perdieron en el uno contra uno y luego sin disputar la segunda jugada le permitió a los del Sabalero poder llegar. En estos primeros tramos el arquero visitante Tomás Marchiori, comenzó a ser la figura de su equipo.La superioridad del equipo santafesino se plasmó en el resultado a los 22 minutos cuando Eric Meza recibió el pase de Ramón Ábila y su remate se desvió en Nicolás Romero y el árbitro consideró que fue en contra del defensor del Decano. No obstante, el futbolista Sabalero lo festejó con sus compañeros y se lo dedicó a su padre que falleció el viernes.Atlético Tucumán no reaccionó y Colón mantuvo su superioridad con Rubén Botta como principal credencial y el propio Meza.En el complemento Colón mantuvo su superioridad y Atlético Tucumán buscó el empate, pero careció de profundidad. En los últimos minutos el Sabalero se dedicó a aguantar el resultado y el Decano fue por el empate.En el tiempo adicionado Atlético Tucumán quedó expuesto en el fondo y Santiago Pierotti hizo una gran jugada y entre dos gambeteó para quedar mano a mano con Marchiori y en lugar de rematar se le dio a Jorge Benítez, que remató y el arquero del Decano le ahogó el grito.Con esta victoria Colón está saliendo de la zona de descenso directo y ese lugar ahora lo ocupa Tigre, que el martes jugará de local ante Godoy Cruz, uno de los líderes de la Zona B, desde las 19.Colón queda en el puesto 24º de la tabla anual con 42 puntos y detrás se ubican Sarmiento de Junín y Huracán con 41 (también adeudan sus partidos) y Tigre, con 40.Además, Colón trepó a la tercera posición en la Zona A de la Copa de la Liga y por ahora es uno de los cuatro se estaría clasificando a los cuartos de final. En la próxima fecha visitará a Banfield el lunes 6 de noviembre, desde las 21.Formaciones:Colón: Matías Ibáñez; Rafael Delgado, Germán Conti, Facundo Garcés y Emmanuel Mas; Eric Meza, Baldomero Perlazza, Cristian Vega, Rubén Botta, Javier Toledo; y Ramón Ábila. DT: Israel Damonte.Atlético Tucumán: Tomás Marchiori; Alexis Flores, Bruno Bianchi, Nicolás Romero y Matías Orihuela; Renzo Tesuri, Adrián Sánchez, Ramiro Carrera y Joaquín Pereyra; Mateo Coronel y Marcelo Estigarribia. DT: Favio Orsi-Sergio Gómez.Árbitro: Leandro Rey Hilfer.VAR: Ariel Penel.Estadio: Colón de Santa Fe.TV: TNT Sports.Rosario Central 3-1 Argentinos JuniorsRosario Central se impuso 3-1 a Argentinos Juniors en el Estadio Gigante de Arroyito, por la fecha 11 de la zona A de la Copa de la Liga. El triunfo del elenco Canalla lo dejó en zona de clasificación para la próxima Copa Libertadores y quedó a un punto de Vélez, que es cuarto en la Zona A.En el comienzo el Canalla fue más y antes de los 20 minutos se puso 2-0 arriba. Mereció abrir el marcador que llegó a los 12 minutos con un cabezazo de Juan Cruz Komar y a los 17, Ignacio Malcorra habilitó a Jaminton Campaz que desbordó por la izquierda y su centro lo conectó Ariel Cervera.El dominio de Central continuó con el colombiano Campaz como su principal carta para desnivelar por la izquierda. Sus proyecciones generaron peligro y el local dispuso de chances para aumentar su diferencias.En el arranque del complemento Komar lo tomó de la camiseta a Gabriel Ávalos dentro del área y Fernando Espinoza sancionó penal. El propio delantero del Bicho lo ejecutó y descontó para el elenco de La Paternal.Argentinos se motivó por su tanto, pero Central respondió pronto y otra vez mostró su superioridad. Generó llegadas y a los 65 minutos Malcorra quiso buscar un pared, la pelota pegó en Lucas Villalba y el rebote lo capturó el propio volante del Canalla que definió perfecto para poner el 3-1.En el final Central tuvo el cuarto con el ingresado Luca Martinez Dupuy, pero el mexicano había quedado en posición adelantada.El conjunto dirigido por Miguel Ángel Russo marcha en la séptima posición de zona A y con este triunfo por ahora acumula 16 unidades.En tanto que Argentinos Juniors quedó décimo segundo entre catorce equipos en su grupo y en la próxima fecha recibirá a Instituto de Córdoba el sábado 4 de noviembre desde las 15. Mientras que Rosario Central visitará a Barracas Central el lunes 6 de noviembre a las 18.30.Formaciones:Rosario Central: Jorge Broun; Damián Martínez, Juan Cruz Komar, Carlos Quintana y Alan Rodríguez; Kevin Ortiz, Tomás O Connor; Maximiliano Lovera, Ignacio Malcorra y Jaminton Campaz; Ariel Cervera. DT: Miguel Ángel RussoArgentinos Juniors: Alexis Martín Arias; Jonatan Galván, Marco Di Cesare, Lucas Villalba; Alan Rodríguez, Federico Redondo, Franco Moyano, Santiago Montiel; Francisco González Metilli; Gabriel Ávalos y Leonardo Heredia. DT: Pablo Guede.TV: TNT SportsEstadio: Gigante de ArroyitoÁrbitro: Fernando EspinozaVAR: Hernán Mastrángelo"
19,https://www.infobae.com/deportes/2023/10/29/max-verstappen-vencio-en-una-accidentada-carrera-en-el-gran-premio-de-mexico-de-la-formula-1/,deportes,Max Verstappen venció en una accidentada carrera en el Gran Premio de México de la Fórmula 1,"Este domingo Max Verstappen logró su victoria número 16 en la temporada al imponerse en el Gran Premio Ciudad de México de la Fórmula 1 en el Autódromo Hermanos Rodríguez. En la decimonovena fecha el tricampeón mundial fue escoltado por Lewis Hamilton (Mercedes) y Charles Leclerc (Ferrari).En el inicio Verstappen hizo una gran largada, ya que desde la tercera posición igualó la línea del poleman, Charles Leclerc (Ferrari), y el que se sumó fue Sergio “Checo” Pérez (Red Bull), que tras los 800 metros de la recta principal al llegar a la primera curva su goma trasera derecha se enganchó con la delantera izquierda del monegasco y se despistó. El azteca pudo volver a los boxes, pero abandonó por daños en su RB 19.La carrera fue neutralizada para retirar algunos elementos del auto de Checo Pérez que quedaron tras el toque con Leclerc. Una vez reiniciada la competencia, Verstappen hizo una diferencia superior a los dos segundos sobre las Ferrari de Leclerc y Sainz.En la vuelta 19 Verstappen hizo su primera parada en los boxes y le colocaron gomas de compuesto duro. Volvió a pista en la sexta ubicación y le tomó cinco giros superar a sus rivales y quedar tercero detrás de las Ferrari, cuyos pilotos adeudaban sus paradas.Una vez que los coches rojos de Maranello hicieron sus detenciones en los boxes, Verstappen recuperó el mando. Su ritmo en la punta fue letal y llegó a hacerle 19 segundos a Leclerc.En la ronda 34, Kevin Magnussen perdió el control de su Haas y chocó en un curva. El danés llegó a bajarse del coche que tuvo un principio de incendio en su parte posterior, pero de inmediato aparecieron los auxiliares de pista para apagar el fuego. El nórdico no sufrió consecuencias y se bajó caminando.Ante esta incidencia se dio la segunda neutralización de la carrera y Verstappen efectuó su segunda parada en los boxes, aunque luego la competencia se paró con bandera roja para retirar el monoposto de Magnussen, acomodar las defensa Tech Pro (elementos que sirven para absorber los golpes de un auto) y limpiar la zona del impacto.En la segunda largada Verstappen se mantuvo adelante y luego Lewis Hamilton (Mercedes) dio cuenta de Leclerc y quedó segundo. Los Mercedes mejoraron en su ritmo y de hecho George Russell redujo distancia con Carlos Sainz y buscó superar al español, pero no pudo conseguirlo.En al tramo final Verstappen reguló su ritmo, pero igual le alcanzó para mantener una diferencia suficiente para poder vencer. Luego de 71 giros vio primero la bandera de cuadros. En el podio lo escoltaron Hamilton y Leclerc.La baja de Pérez fue un golpe duro debido a que era la carrera ante su gente y además porque quedó comprometido en la lucha por el subcampeonato. Hamilton se le acercó y en las últimas tres fechas el séptuple campeón mundial buscará batir al mexicano.El top ten lo completaron Carlos Sainz (Ferrari), Lando Norris (McLaren), George Russell (Mercedes), Daniel Ricciardo (Alpha Tauri), Oscar Piastri (McLaren), Alex Albon (Williams) y Esteban Ocon (Alpine).El gran circo seguirá el próximo fin de semana con el Gran Premio de San Pablo en el Autódromo José Carlos Pace de Interlagos, en Brasil.GRAN PREMIO DE MÉXICO - CLASIFICADORTOP 5 CLASIFICACIÓN MUNDIAL1 Max Verstappen (campeón con Red Bull): 491 puntos2 Sergio Pérez (Red Bull): 240 puntos3 Lewis Hamilton (Mercedes): 220 puntos4 Carlos Sainz (Ferrari) 183 puntos5 Fernando Alonso (Aston Martin) 183 puntosCampeonato Mundial de Constructores (5 primeros)1 Red Bull 7312 Mercedes 3713 Ferrari 3494 McLaren 2565 Aston Martin 236"
20,https://www.infobae.com/deportes/2023/10/29/impacto-abandono-y-lagrimas-asi-fue-el-toque-que-dejo-a-checo-perez-afuera-del-gp-de-mexico-de-la-f1-en-la-primera-vuelta/,deportes,"Impacto, abandono y lágrimas: así fue el toque que dejó a Checo Pérez afuera del GP de México de la F1 en la primera vuelta","Fue la octava oportunidad que tuvo Sergio “Checo” Pérez para poder vencer ante su gente. Desde el regreso de México al calendario de la Fórmula 1 en 2015 (en 2020 no se corrió por la pandemia de COVID-19), la expectativa es enorme en tierras aztecas, por eso las lágrimas del nacido hace 33 años en Guadalajara tras abandonar este domingo a 800 metros del inicio con su Red Bull. Duró en carrera apenas 18 segundos. Esperó un año por esta carrera.La largada tuvo a las dos Ferrari adelante, con Charles Leclerc como el poleman y Carlos Sainz, que fue segundo en la clasificación. Pero entre ellos se metió Max Verstappen, que con su Red Bull llegó a la par con Leclerc a la primera curva y por el lado externo aprovechó Checo Pérez.El local llegó a la misma línea que Verstappen y Leclerc, pero ni el mexicano ni el monegasco levantaron el pie del acelerador, exigieron la frenada y la goma trasera derecha del Red Bull se enganchó con la delantera izquierda de la Ferrari y se despistó. El azteca pudo volver a los boxes, pero abandonó por daños en su RB 19.* Las imágenes del incidenteEn los boxes los mecánicos de Red Bull intentaron reparar su auto, que tuvo daños en la parte posterior. Lo metieron dentro del garage y aún arriba de su monopostos se vio el llanto de Checo Pérez, que llegó a secarse las lágrimas sus guantes. Pasaron unas vueltas y cuando le informaron que no era posible arreglar el coche, el azteca se bajó con una gran decepción e impotencia.Se fue a la parte posterior del garage y estuvo unos minutos solo. Luego apareció con el equipo, les agradeció su trabajo, pero su rostro de decepción lo dijo todo. Es que esperó todo el año para esta carrera y vivió un dolor sin igual.Más tarde, un poco más tranquilo, dio declaraciones en la zona mixta que se arma para la prensa acreditada a nivel anual y manifestó que “lo intentamos todo y fui por eso. Cuando vi el hueco vi la oportunidad. No esperaba que Leclerc frenara similar a nosotros. Tuve un margen de maniobra mejor que Charles”, analizó el toque.Aunque dejó claro que en una nueva carrera ante su gente fue por lo máximo. “Hoy quería ganar la carrera, no me conformaba con un podio”, reconoció. Ante las 15 victorias anteriores de su compañero de equipo Max Verstappen, que se coronó tricampeón de forma anticipada, Checo imaginó que éste era su domingo.No fue un abandono más para Pérez, ya que esto compromete su objetivo de llegar al subcampeonato. Por ahora se mantiene segundo en el certamen, pero la segunda posición conseguida por Lewis Hamilton en el Autódromo Hermanos Rodríguez lo complica de cara a las tres fechas finales.Aunque, más allá de la lucha por el subcampeonato, la mayor decepción que vive Checo Pérez es que siguen pasando los años y no puede ganar en su tierra. Más allá de que Leclerc también arriesgó de más, un piloto de la experiencia del mexicano no lo debería haber llevado a exigir la maniobra. Tenía toda la carrera por delante para intentar ganar. Y una de la grandes frases de Juan Manuel Fangio es que las carreras no se ganan en la primera curva."
21,https://www.infobae.com/deportes/2023/10/29/choque-y-principio-de-incendio-el-impactante-accidente-de-kevin-magnussen-en-el-gp-ciudad-de-mexico-de-la-formula-1/,deportes,Choque y principio de incendio: el impactante accidente de Kevin Magnussen en el GP Ciudad de México de la Fórmula 1,"El Gran Premio de la Ciudad de México de Fórmula 1 tuvo su primer golpe de escena con el toque que dejó afuera a Sergio “Checo” Pérez con su Red Bull luego de la largada. Pero cerca de la mitad de la carrera los corazones de todos se detuvieron con el impresionante accidente de Kevin Magnussen que destrozó su Haas en una de las curvas.En la vuelta 34, Magnussen perdió el control de su Haas y chocó en un curva. El danés llegó a bajarse del coche, que tuvo un principio de incendio en su parte posterior, pero de inmediato aparecieron los auxiliares de pista para apagar el fuego. El nórdico no sufrió consecuencias y descendió caminando.Ante esta incidencia se dio la segunda neutralización de la carrera y Max Verstappen, que ya era líder, efectuó su segunda parada en los boxes, aunque luego la competencia se paró con bandera roja para retirar el monoposto de Magnussen, acomodar las defensa Tech Pro (elementos que sirven para absorber los golpes de un auto) y limpiar la zona del impacto. Estos elementos reemplazaron o complementan a los muñecos de gomas en los circuitos.Lo más importante es que el escandinavo no sufrió consecuencias aparte del susto debido al impacto en la variante del Autódromo Hermanos Rodríguez. Luego de que retiraron el Haas y el lugar quedó en condiciones los comisarios deportivos, en la pista le informaron de la situación a la Dirección de Carrera, que ordenó que se volviera a largar.Una vez reiniciada la competencia, Verstappen pudo mantenerse adelante y pronto se volvió a alejar de Charles Leclerc, que con su Ferrari no pudo mantener el ritmo y también perdió la segunda posición a manos de Lewis Hamilton (Mercedes).Fue otra demostración de superioridad de Verstappen, que llegó a 16 victorias sobre 19 Grandes Premios disputados en la temporada. Su exhibición lo llevó a sacarle 19 segundos en su momento a Leclerc y luego terminó venciendo por 13 de diferencia respecto de Hamilton.En al tramo final, Verstappen reguló su ritmo, pero igual le alcanzó para mantener una diferencia suficiente para poder vencer. Luego de 71 giros vio primero la bandera de cuadros. En el podio lo escoltaron Hamilton y Leclerc.El top ten lo completaron Carlos Sainz (Ferrari), Lando Norris (McLaren), George Russell (Mercedes), Daniel Ricciardo (Alpha Tauri), Oscar Piastri (McLaren), Alex Albon (Williams) y Esteban Ocon (Alpine).El gran circo seguirá el próximo fin de semana con el Gran Premio de San Pablo en el Autódromo José Carlos Pace de Interlagos, en Brasil."
