,url,categoria,titulo,texto
0,https://www.infobae.com/economia/2023/10/29/massa-o-milei-la-contundente-respuesta-de-un-ex-lider-del-tesoro-de-eeuu-y-del-fmi/,economia,¿Massa o Milei?: la contundente respuesta de un ex líder del Tesoro de EEUU y del FMI,"El economista Mark Sobel, ex subsecretario del Tesoro de EE.UU. y ex representante de su país en el Fondo Monetario Internacional (FMI) contó que ninguno de los dos candidatos presidenciales para el balotaje del domingo 19 de noviembre puede garantizar avances en las reformas que recomienda el organismo para estabilizar la economía argentina.En diálogo con Infobae, Sobel dijo que el espacio que representa a Sergio Massa siempre se mostró reacio a los cambios para estabilizar los precios y que Javier Milei no cuenta ni con la experiencia ni los conocimientos para hacerlo.Horas antes, el experto en finanzas internacionales y líder del Official Monetary and Financial Institutions Forum (Omfif), había afirmado que el resultado de las elecciones del domingo 22 de octubre debería ser decepcionante para el FMI.En el Tesoro, Sobel dirigió la labor del Departamento en la preparación de las reuniones de ministros de finanzas y gobernadores de bancos centrales del G7 y el G20, la formulación de las posiciones de Estados Unidos en el FMI y la coordinación de la labor del Tesoro y los organismos reguladores en el Consejo de Estabilidad Financiera (CEF). Además, gestionó el Fondo de Estabilización Cambiaria del Tesoro, dotado con más de 100.000 millones de dólares, y desempeñó un papel clave en la política cambiaria estadounidense.“En Marrakech se habló poco de los problemas de Argentina y sus consecuencias para el FMI, mientras el mundo se anticipaba a la primera vuelta de las elecciones presidenciales”, afirmó en su publicación.“Una vez conocidos los resultados, probablemente no podrían haber sido más desalentadores para el FMI, dada su esperanza de que Argentina finalmente emprendiera reformas y comenzara a pagar su enorme deuda con el Fondo”, afirmó.“En lugar de ello, el FMI se enfrenta a la disyuntiva de trabajar con un partido que históricamente ha sido antagónico con un líder que ha presidido políticas macroeconómicas horribles y gastos desorbitados que iban en contra del programa del Fondo”, dijo en relación al oficialismo.Pero también se refirió al candidato Javier Milei, “alguien no probado, excéntrico y probablemente incapaz de aplicar las reformas que se necesitan desesperadamente”. Ante este panorama, estas fueron sus declaraciones a Infobae:— Su escasa esperanza de avanzar en las reformas solicitadas por el FMI: “El movimiento kirchnerista-peronista tiene un largo historial de antagonismo hacia el FMI. Massa ha presidido políticas muy pobres e incluso participadas en gastos pre-electorales contrarios al programa del Fondo. Los gastos probablemente han minado la confianza en el FMI; necesitará un enfoque completo y nuevo de reforma para restablecer la salud y la viabilidad económicas.“Y si Milei ganara, ¿cuánto respaldo parlamentario tendría probablemente para implementar políticas radicales? e incluso si se necesitan importantes reformas fiscales, más allá de los lemas, ¿cuán realistas son los fundamentos técnicos?— Los eventuales resultados de un gobierno de Milei o Massa— No soy argentino; corresponde al pueblo argentino decidir. Más allá de quién gane, para el bien de la economía a largo plazo, Argentina necesita controlar sus excesos fiscales: evitar el endeudamiento interno excesivo que obliga al Banco Central a monetizar la deuda, lo que resulta en una alta inflación, y evitar el endeudamiento externo excesivo durante varias décadas que llevaron a que el país sea un incumplidor serial. El Banco Central necesita tomar una fuerte ruta antiinflacionaria, y poner fin a la dominancia fiscal es clave.— La influencia del FMI en las elecciones tras haberle girado USD 7.500 millones al Gobierno en agosto— Si un país acepta las reformas del FMI y luego, aparente intencionalmente no las implementa, eso puede interpretarse como un grave incumplimiento de confianza. El FMI existe para ayudar al país. Esa falta de confianza debe guiar a la toma de decisiones del Fondo en el futuro. Como dijo el subsecretario del Tesoro, Jay Shambaugh, en un discurso reciente, el FMI no debe participar en un uso prolongado y repetir programas en países que no hacen reformas.— La fijación del tipo de cambio o dolarización como anclas frente a la alta inflación— “Un tipo de cambio fijo podría proporcionar un ancla más transparente para la estabilización que un duro programa de reforma fiscal, complementado con una resolución resoluta al crecimiento del crédito. Sin embargo, la historia demuestra que los países han enfrentado enormes dificultades para salir de los regímenes de tipo de cambio fijo. Esa es una lección crítica de la crisis de Asia e incluso de la experiencia de Rusia y Brasil en 1998. Los líderes no quieren devaluar sus monedas por temor a una reacción pública adversa y a las repercusiones en las cuentas públicas; la consecuencia es que los países se adaptan a una moneda sobrevaluada, se acumulan enormes desequilibrios generales y las crisis monetarias son bastante destructivas para las economías y los sistemas financieros de los países”.“Como lo demostró Alemania en los años 60, en esos casos relevantes, a los líderes tampoco les gusta revaluar sus monedas debido a las reacciones adversas de los exportadores. Los tipos de cambio flotantes, anclados por políticas fiscales y monetarias sólidas, proporcionan una resiliencia considerable”.Más allá de la Argentina, Mark Sobel planteó en su último artículo que “la deuda de los países de renta baja y de los mercados emergentes está obteniendo escasos beneficios”.“Zambia llegó por fin a un acuerdo con sus acreedores oficiales, cuyas ventajas se verán en el futuro. Sri Lanka llegó por sorpresa a un acuerdo con el Banco de Exportaciones e Importaciones de China, pero aún se están evaluando los detalles y si se ajustan al análisis de sostenibilidad de la deuda del FMI”.“El camino a seguir es inconexo y no está claro si los avances son sostenibles o sientan precedente”, aseguró.“Los mercados y los economistas son notoriamente malos a la hora de tener en cuenta y valorar los riesgos políticos, aunque no sean ajenos a ellos. Tienden a pensar linealmente dentro de bandas de confianza. Si Marrakech fue sombrío, los últimos acontecimientos pueden ser aún más aleccionadores”, advirtió.“La geopolítica fue el gran elefante en la sala de Marrakech. Las tensiones entre Estados Unidos y China eran motivo de preocupación. La bárbara guerra de Rusia contra Ucrania no ha cesado y cada vez hay más dudas sobre si Estados Unidos seguirá contando con el apoyo del Congreso”, precisaron los máximos referentes del encuentro.“Los funcionarios se inquietaron por los costos de la fragmentación y el reordenamiento de las cadenas de suministro para la economía mundial”, fue una de las conclusiones.“Pero mientras esas preocupaciones siguen intactas, otro riesgo geopolítico ha levantado la cabeza. El temor a una escalada tras el ataque del 7 de octubre de Hamás a Israel que desemboque en una conflagración total en Oriente Próximo se cierne ahora sobre nosotros”, detalla el experto.“Si el conflicto arrastra a los EE.UU., podría magnificar lo que sería un golpe limitado a la economía mundial en un nuevo choque mayor”, advirtió Sobel.“Los debates sobre una economía mundial anémica ocuparon un lugar central en Marruecos. En general, se consideró que la Reserva Federal de Estados Unidos y el Banco Central Europeo estaban al final o muy cerca del final de sus ciclos de subidas de tasas. También se expresó preocupación por el estancamiento de China, dijo el ex funcionario del FMI.“Dado que se considera que el aumento de los rendimientos endurecerá aún más las condiciones financieras y quizá ayude a la Reserva Federal a evitar la necesidad de nuevas subas de tasas, las expectativas del mercado de que EE.UU. logre un aterrizaje suave están impregnadas de una mayor incertidumbre”, estimó.Sobel agregó: “La volatilidad de los precios del petróleo no ayudará. Es comprensible que ahora haya aún más temores de que algo se rompa en el sector financiero, dados las tasas de interés más altas y la languidez de las economías”.“En el lado positivo, hay una esperanza incipiente de que la economía china pueda estar mostrando signos de estabilización, a pesar de los problemas de la vivienda y los defaults, y de que esté tocando fondo por el momento”, afirmó el economista.“La disfunción política estadounidense también desempeñó un papel importante en los debates de Marrakech. Los asistentes de fuera de EE.UU. se preguntaron si Donald Trump podría realmente ser el candidato republicano a la presidencia y volver a ganar a pesar de las numerosas pruebas en su contra”, admitió Sobel.“Se preguntaban si EE.UU. evitará un cierre del gobierno el 17 de noviembre y si los republicanos de la Cámara de Representantes podrán ‘ponerse las pilas’. Desde Marrakech, las preguntas no han hecho más que hacerse más fuertes ante la incapacidad de la Cámara de Representantes para funcionar”, confesó.“Los mercados carecen de convicción. La disfunción política estadounidense y la adversa trayectoria fiscal sólo pueden hacer tambalear la confianza en el liderazgo de Estados Unidos”, escribió.Sin embargo, concluyó Mark Sobel, “el papel de Estados Unidos en su colaboración con Oriente Próximo, mientras Europa parece al margen, y los altos rendimientos siguen atrayendo fondos en medio de un entorno volátil de aversión al riesgo”.Dado este diagnóstico, al próximo presidente de la Argentina, más allá de los problemas internos del país, no le tocará un contexto internacional sencillo para gobernar."
1,https://www.infobae.com/economia/2023/10/29/el-resurgimiento-de-los-clubes-de-chacras-terrenos-amplios-privacidad-y-vida-rural-pero-cerca-de-la-ciudad/,economia,"El resurgimiento de los Clubes de Chacras: terrenos amplios, privacidad y vida rural,  pero cerca de la ciudad","Los Clubes de Chacras están recuperando su protagonismo, atrayendo a familias con hijos pequeños que desean adquirir terrenos de gran extensión para construir sus hogares en entornos rurales, caracterizados por una abundante vegetación, y ubicados a más de 70 kilómetros de la ciudad de Buenos Aires.Desde la llegada del Covid-19, el éxodo de las familias desde las grandes ciudades no disminuyó. Lo impulsan personas que buscan una forma de vida diferente, alejada de la reclusión en departamentos y con espacio para juegos. En muchos casos, la tecnología posibilita flexibilidad en la elección del lugar de residencia, permitiendo que muchas personas se establezcan en zonas más alejadas mientras continúan trabajando desde casa.Jorge Santa María, de ISM inmuebles, destacó a Infobae: “hoy, la mayoría de las personas busca dar prioridad a espacios amplios y a la sensación de seguridad y tranquilidad que ofrecen los polos urbanos ubicados a cierta distancia de CABA. La proximidad de urbanizaciones cerradas como Chacras de la Reserva y La Macarena a colegios de alta calidad, ciudades como Campana, Zárate, Capilla del Señor, Pilar y Escobar, parques industriales, entre otros, brinda comodidades y servicios que refuerzan esta tendencia”.Hace unos años, el auge se centraba en la adquisición de casas de fin de semana. Pero la expansión de la modalidad Home Office, la disponibilidad de Internet de alta velocidad, y la creciente búsqueda de espacios verdes han llevado a que un gran número de personas opten por realizar un cambio de vida, mudándose de forma definitiva a lugares y urbanizaciones que ofrecen estas características con lotes que superan los 2.500 metros cuadrados y llegan hasta 10 hectáreas en algunos casos.“Tanto en Chacras de la Reserva como en La Macarena, actualmente, familias con niños y parejas de adultos mayores optan por establecerse cerca de entornos arbolados, donde conviven especies nativas y terrenos ondulados con pintorescas lagunas”, comentó Santa María.Los precios de los lotes varían desde USD 50.000 hasta USD 95.000 (La Reserva), y de 10.000 m2 hasta 14.000 m2 oscilan desde USD 120.000 y USD 200.000 (La Macarena). Mientras que las casas tienen un rango de precios que oscila entre USD 230.000 y USD 1.100.000, dependiendo de su tamaño y cantidad de ambientes, siendo las más grandes aquellas con parcelas extensas.En Zárate también hay varias propuestas, entre ellas Chacras del Paraná y Estancia El Aduar. Esta última tiene la virtud de estar diseñada en un campo histórico de 760 hectáreas, que tiene 3 km de costas, con salidas a los ríos Paraná de las Palmas, Areco y Baradero.“Las chacras con lotes amplios mantienen su atractivo gracias a la combinación de naturaleza, vistas panorámicas, arboledas y barrancas junto al río Paraná. Las urbanizaciones con lotes más grandes atraen a nuevos residentes en busca de mayor privacidad y un estilo de vida campestre”, dijo Damián Bourdieu, de DBI Desarrollos Argentina y Uruguay en urbanizaciones rurales.Para adquirir un lote, los interesados suelen proporcionar información financiera que demuestre su capacidad para pagar, ya que actualmente no existen opciones de crédito bancario para este propósito.Los precios de los lotes varían. En Estancia El Aduar, oscilan entre USD 180.000 y USD 790.000, mientras que en Chacras del Paraná van desde USD 67.300 hasta USD 110.000; en algunos casos se ofrece financiación.Puerto Panal, también en Zárate, tiene canchas de polo, club house, amarras y acceso directo al río Paraná de las Palmas.“Algunos eligen el estilo de vida rural a tiempo completo, mientras que otros lo utilizan como una escapada de fin de semana para relajarse y desconectar”, añadió Bourdieu.Entre los partidos de Luján, General Rodríguez y San Andrés de Giles hay varios proyectos de clubes de chacras.Está Comarcas en territorio lujanense con cinco barrios dentro del desarrollo y actualmente se dio comienzo a la construcción de un centro comercial.“La mayor superficie de estos lotes generalmente conlleva un precio más alto en el valor total, aunque el costo por metro cuadrado es menor en comparación con lotes más pequeños. Aquellos que eligen estos lotes de una hectárea priorizan la privacidad, la posibilidad de construir viviendas amplias y espacios para actividades al aire libre”, dijo a Infobae Néstor Ruiz, director general de la desarrolladora Grupo Dinal.Para acceder a la compra de un lote en un barrio de chacras, generalmente se necesita la asistencia de un agente de ventas en el lugar. Las comisiones pueden variar y suelen ser un porcentaje del valor del lote. Los requisitos pueden incluir una prueba de solvencia económica y cumplir con las regulaciones locales.Los lotes en el Club de Campo Santa Matilde tienen un precio que comienza en USD 98.000 con un metraje de 10.000 m2.“No ofrecen planes de financiación. Hay posibilidades de permuta, entrega de vehículos y parte en efectivo”, amplió Ruiz.Por otro lado, tanto Tres Pinos Villa de Campo como Chacras de San Andrés mantienen su atractivo debido a su enfoque en sustentabilidad y autonomía energética, lo que impacta positivamente en las emisiones ambientales, costos de construcción y mantenimiento, y accesibilidad a la vivienda.Grace Cabanillas, gerente de ventas de la desarrolladora MJM Inversiones, dijo a Infobae que “se financian los lotes, lo que permite opciones de compra tanto al contado como con adelanto y en cuotas, lo que atrae a inversores y aquellos que buscan calidad de vida. Los bienes raíces se destacan como activos reales y comercializables, lo que los hace valiosos en tiempos de incertidumbre económica”.Son ventas directas y no se paga comisión, aquellos que opten por comprar en cuotas acceden con un adelanto del 50% y hasta 60 cuotas dependiendo el precio del desarrollo y lote (en Tres Pinos de 1.000 m2 parten desde USD 18.000 y en Chacras de San Andrés de 2.000m2 desde USD 40.000 precio contado).Tres Pinos, se ha expandido recientemente de 500 a 836 hectáreas, ofreciendo 13 barrios en General Rodríguez. “Entre sus comodidades, sobresalen una pileta semiolímpica con playa húmeda, espacios deportivos como tenis, pádel, fútbol, polo, salto y golf. El proyecto incluirá un Colegio Nikola Tesla con un enfoque tecnológico y artístico”, dijo Cabanillas.Chacras de San Andrés propone canchas de polo, un restaurante, marina y espacios de coworking con fibra óptica.En el caso de El Metejón, ubicado en Cañuelas, todos los lotes están diseñados con fondos libres que se abren hacia canchas de polo, lagunas, arroyos o bosques. Además, cerca del 50% de la superficie del barrio se destina a espacios comunes, adornados con arboledas autóctonas.“La adquisición de un lote es sencilla a través de ventas directas sin comisión inmobiliaria. Los interesados pueden reservar el lote, lo que otorga el boleto de compraventa, o proceder directamente a la escritura, dependiendo del terreno adquirido. Los precios de los lotes desde 3.700 m2 parten desde USD 250.000, ideales para quienes buscan fondos a la cancha de polo”, detalló a Fleur van Andel, directora de Mijo, desarrolladora de El Metejón.Además, se comercializan lotes más pequeños de unos 2.000 m2, con la posibilidad de unificarlos hasta alcanzar los 6.000 m2, lo que facilita a los compradores ajustar las dimensiones deseadas con una sola expensa.Propone quincho con piscina, parrilla y solarium y lagunas para deportes náuticos sin motor. También cuenta con instalaciones ecuestres, como caballerizas y canchas de polo, y un hotel boutique.Van Andel agregó que “en la actualidad, se han completado 27 casas en El Metejón, mientras que 10 se encuentran en construcción”.Otra propuesta en el sur se encuentra en el barrio de chacras del partido de Brandsen llamado Estancias Malvinas. Este complejo se extiende sobre 2.000 hectáreas a lo largo de las costas del río Samborombón.Marcos M. Yacoub, director general de gestión de cartera del Estudio Yacoub, dijo que “los compradores suelen ser personas que muchas veces eligen estas propiedades como vivienda principal, especialmente si tienen la capacidad de trabajar a distancia y sólo necesitan acercarse a la ciudad ocasionalmente. Los lotes se subdividen en tamaños que van desde 5.000 hasta 30.000 m2, lo que brinda la posibilidad de crear huertas, mantener caballos, vacas y ovejas, y disfrutar de una vida más cercana a la naturaleza”.Estancia Malvinas se encuentra a 1 kilómetro del centro de Brandsen, a 20 minutos del centro de La Plata y a menos de 1 hora de CABA. Cuenta con una amplia variedad de áreas comunes, incluyendo 2 clubhouses con salones climatizados para eventos y actividades, pulpería, restaurantes y bodegas. Los terrenos allí arrancan en 42.000 dólares.“Si bien estas chacras ofrecen un escenario ideal para pasar los fines de semana, es notable que la mayoría de los propietarios optan por vivir de manera permanente”, concluyó Yacoub."
2,https://www.infobae.com/economia/2023/10/29/exportaciones-de-carne-vacuna-la-argentina-depende-cada-vez-mas-del-mercado-chino-que-cada-vez-paga-menos/,economia,"Exportaciones de carne vacuna: la Argentina aumenta su dependencia del mercado chino, que cada vez paga menos","El sector ganadero sigue sufriendo las consecuencias de un año completamente atípico. La sequía y la consecuente escasez de pasturas obligó a acelerar la salida de animales de los campos, lo que derivó en un aumento de la producción que generó una fuerte sobreoferta en el mercado interno durante la primera mitad del 2023 y bajas de precios en términos reales -la situación comenzó a revertirse en el segundo semestre y daría un fuerte giro a partir de las recientes lluvias.El escenario presionó a los frigoríficos a intensificar sus ventas externas: encontraron resguardo en un mercado chino insaciable, que cada vez compra más carne. Según un informe de la Bolsa de Comercio de Rosario, en lo que va de este año, las importaciones de carne vacuna por parte de China en el exterior ascienden a poco más de dos millones de toneladas, lo que marca un nuevo récord en compras, superando en un 5% el volumen importado en igual período de 2022.Pero en materia de precios, el dato de septiembre (USD 4.924 por tonelada) es 27,5% inferior a los valores registrados un año atrás y solo supera los pisos alcanzados a finales de 2020, en plena pandemia. En este escenario de mucha demanda en volumen, pero a bajos precios, Argentina queda completamente expuesta.“De acuerdo a nuestra propia estadística de salida publicada por el Indec, en lo que va del año (enero-septiembre) China se está llevando más de tres cuartas partes de nuestras exportaciones de carne vacuna, habiendo incluso alcanzado el 83% de participación en mayo”, señalaron desde la entidad.Se trata de una relación en que las cartas de negociación están muy desbalanceadas, ya que a la vez que China absorbe 76% del volumen de carne vacuna que exporta la Argentina, el país le provee menos de la mitad de lo que el gigante asiático le compra a Brasil. Y las sumas de lo que le compra a Uruguay, Australia y EEUU superan lo que le provee la Argentina. Ergo, los exportadores de carne argentinos dependen de los compradores chinos mucho más que estos de ellos.De enero a septiembre de este año, los datos de importación de China muestran a Brasil abasteciendo el 41% del mercado, seguido por Argentina con el 20%, Uruguay el 10%, Australia un 8% y Estados Unidos un 6% del total de sus compras.En ese mismo período -aunque computando estadísticas de salida que, dependiendo del origen, pueden tener un desfasaje de entre 20 y 60 días hasta impactar en destino- Argentina es el proveedor que mayor concentración presenta en este mercado con un 76% de participación. En este orden lo siguen Uruguay con el 56%, Brasil este año con el 49%, Australia con el 20% y EE.UU. con un 15% de concentración. Esto es, la Argentina es el país más “jugado” con el mercado chino.“Sin dudas, en este año el mercado de carnes se encuentra presionado por la fuerte competencia que están ejerciendo dos grandes jugadores como son Brasil y Australia; este último aportando cerca de 300.000 toneladas adicionales de carne al mercado externo”, señalaron desde la Bolsa de Comercio de Rosario.“A su vez, Argentina tampoco escapa a esta situación. En un año en el que localmente se conjuga una fuerte oferta ganadera producto de la seca con un mercado interno sin capacidad de absorber volúmenes adicionales de producción, el saldo exportable indefectiblemente debe encontrar destino”, agregaron.En síntesis, dentro es un mercado caracterizado por la sobreoferta, es China el “peso pesado” que define la suerte de cada productor. En el caso de Argentina, el país asiático está absorbiendo más del 75% de su carne vacuna de exportación, pero está pagando mucho menos que en temporadas anteriores.Según el Departamento de Agricultura de los Estados Unidos (USDA), para 2024 las exportaciones mundiales de carne vacuna aumentarían en un 1% a 11,9 millones de toneladas. Nuevamente, tanto para Brasil como para Australia el organismo proyecta un importante aumento de la producción, la cual se trasladaría en gran medida a exportaciones. Esto genera un fuerte competencia para la Argentina, lo que presionará aún más los valores.En este punto, desde la Bolsa de Comercio de Rosario plantearon dos incógnitas que podrían derivar en una oportunidad clave. “A diferencia de lo que se ha visto este año, se trata de testear la reacción del mercado ante la menor oferta ganadera que se espera para el próximo ciclo y por el otro, en este contexto, determinar cuán asertivos logremos ser, trabajando estratégicamente hacia una mayor diversificación de nuestros mercados”, apuntaron."
